{
  "schemaVersion": 1,
  "product": "Nikkiward",
  "channel": "preview",
  "version": "0.1.0-preview.4",
  "tag": "v0.1.0-preview.4",
  "commitSha": "0123456789abcdef0123456789abcdef01234567",
  "minimumSupportedVersion": "0.1.0-preview.1",
  "publishedAtUtc": "2026-08-17T00:00:00Z",
  "package": {
    "fileName": "Nikkiward-win-x64.zip",
    "sha256": "0123456789ABCDEF0123456789ABCDEF0123456789ABCDEF0123456789ABCDEF",
    "size": 1,
    "runtimeIdentifier": "win-x64",
    "format": "zip"
  },
  "signature": null
}
